{
  "app": {
    "name": "RCE Video",
    "fullName": "Reliable Generative AI Context Engineering Video Learning",
    "version": "2.0.2",
    "iteration": 10,
    "status": "maintenance-v2.0.2-windows-helper-path-and-deploy-validation-hardening"
  },
  "sourceAssessmentDate": "2026-08-02",
  "chapterCount": 5,
  "videoCount": 40,
  "totalDurationSeconds": 2988.292,
  "totalDurationLabel": "49:48",
  "hosting": {
    "strategy": "github-pages-direct",
    "mediaOrigin": "same-origin",
    "pathPolicy": "repository-subpath-safe-relative-paths",
    "packageMode": "application-only-copy-media-folder",
    "mediaInstallPath": "site/media",
    "deploymentPreparation": "generated-deploy-folder",
    "primaryDeployment": "github-desktop-main-branch-root"
  },
  "mediaAccessibility": {
    "captionsIncluded": false,
    "transcriptsIncluded": false,
    "decision": "Project owner specified that captions and transcripts will not be included."
  },
  "sequenceDecisions": {
    "chapter1": "Iteration 0 proposed order adopted for Iteration 1.",
    "chapter5": "Iteration 0 manifest-derived order adopted for Iteration 1."
  },
  "chapter2FigureDecision": {
    "videoId": "ch2-v03",
    "selectedSource": "chp2 images/figures/How_AI_Context_Selection_Works_Textbook_Figure.png",
    "selectedBytes": 892585,
    "rejectedVariant": "chp2 images/Reliable_Generative_AI_Context_Engineering_Chapter_2_Video_Figures/How_AI_Context_Selection_Works_Textbook_Figure.png",
    "reason": "Project owner explicitly selected the PNG in the figures folder."
  },
  "chapters": [
    {
      "id": "ch1",
      "number": 1,
      "title": "Foundations of Context Engineering",
      "summary": "Establishes how context windows, grounding, memory, dynamic facts, and structured context shape AI behavior.",
      "videoCount": 8,
      "durationSeconds": 578.178,
      "durationLabel": "9:38",
      "videos": [
        {
          "id": "ch1-v01",
          "chapterId": "ch1",
          "sequence": 1,
          "title": "Why AI Models Guess Wrong",
          "description": "AI guesses go wrong when a task requires exact current values that were not provided in the context.",
          "concept": "Root cause of guessing: missing exact current values",
          "durationSeconds": 82.315,
          "durationLabel": "1:22",
          "media": {
            "sourceName": "Why_AI_Models_Guess_Wrong.mp4",
            "path": "./media/ch1/v01.mp4",
            "type": "video/mp4",
            "width": 720,
            "height": 1280,
            "videoCodec": "h264",
            "audioCodec": "aac",
            "bytes": 11544437,
            "sha256": "c5cb528ee2b4207fdc36bde14acb1401551c1acc21de2a2b43c5a19f45900710",
            "status": "integrated"
          },
          "figure": {
            "sourceName": "Why_AI_Models_Guess_Wrong_Textbook_Figure.png",
            "path": "./media/ch1/v01.png",
            "type": "image/png",
            "alt": "Diagnostic comparison showing stable instructions with missing dynamic facts on one side and exact current values on the other, leading to failure versus success.",
            "bytes": 1340716,
            "sha256": "9b3e2f26fe698b30bdcf0e5bf369c7f6c8630e6652458a5fe73acdb028b0bb79",
            "status": "integrated",
            "width": 1672,
            "height": 941
          },
          "contentStatus": "integrated",
          "version": "0.3.0"
        },
        {
          "id": "ch1-v02",
          "chapterId": "ch1",
          "sequence": 2,
          "title": "How Context Engineering Bounds AI",
          "description": "A request becomes reliable when it is bounded by role, rules, evidence, memory, current facts, and output format.",
          "concept": "Context package as the bounded working environment for AI",
          "durationSeconds": 71.1,
          "durationLabel": "1:11",
          "media": {
            "sourceName": "How_Context_Engineering_Bounds_AI.mp4",
            "path": "./media/ch1/v02.mp4",
            "type": "video/mp4",
            "width": 720,
            "height": 1280,
            "videoCodec": "h264",
            "audioCodec": "aac",
            "bytes": 9485757,
            "sha256": "2bf4eaa04f21b5bebf6ecfa40c6e3edeba93ec894c9b11c3ab9c43d7508d8cc2",
            "status": "integrated"
          },
          "figure": {
            "sourceName": "How_Context_Engineering_Bounds_AI_Textbook_Figure.png",
            "path": "./media/ch1/v02.png",
            "type": "image/png",
            "alt": "Diagram showing a central request surrounded by role, rules, evidence, memory, current facts, and output format inside a context package boundary.",
            "bytes": 1284037,
            "sha256": "a57c2d25b3bef774c2e5c0731d735a1a481ec5ad5d7611143aa6a2b5dd3d36f3",
            "status": "integrated",
            "width": 1672,
            "height": 941
          },
          "contentStatus": "integrated",
          "version": "0.3.0"
        },
        {
          "id": "ch1-v03",
          "chapterId": "ch1",
          "sequence": 3,
          "title": "How AI Context Windows Actually Work",
          "description": "The context window is finite working memory, so rules, tasks, facts, examples, and history must compete for limited space.",
          "concept": "Finite working memory and token-budget trade-offs",
          "durationSeconds": 76.092,
          "durationLabel": "1:16",
          "media": {
            "sourceName": "How_AI_Context_Windows_Actually_Work.mp4",
            "path": "./media/ch1/v03.mp4",
            "type": "video/mp4",
            "width": 720,
            "height": 1280,
            "videoCodec": "h264",
            "audioCodec": "aac",
            "bytes": 10662691,
            "sha256": "e35e22af780f5790ace4b787bbe26396eb82bbda3e9c187e49b99ec01e57dd27",
            "status": "integrated"
          },
          "figure": {
            "sourceName": "How_AI_Context_Windows_Actually_Work_Textbook_Figure.png",
            "path": "./media/ch1/v03.png",
            "type": "image/png",
            "alt": "Infographic showing a finite context window with a token budget and labeled blocks for rules, task, relevant facts, examples, and chat history, plus overflow items outside the window.",
            "bytes": 1314397,
            "sha256": "85c25ecfdf192205827ebc35d4862cfed757f527c5dbe6564220b754640da1a8",
            "status": "integrated",
            "width": 1672,
            "height": 941
          },
          "contentStatus": "integrated",
          "version": "0.3.0"
        },
        {
          "id": "ch1-v04",
          "chapterId": "ch1",
          "sequence": 4,
          "title": "How to Pack a Context Window",
          "description": "When the window is limited, the best context package prioritizes the highest-value information and leaves lower-value material out.",
          "concept": "Priority-based packing under capacity constraints",
          "durationSeconds": 66.966,
          "durationLabel": "1:07",
          "media": {
            "sourceName": "How_to_Pack_a_Context_Window.mp4",
            "path": "./media/ch1/v04.mp4",
            "type": "video/mp4",
            "width": 720,
            "height": 1280,
            "videoCodec": "h264",
            "audioCodec": "aac",
            "bytes": 9207787,
            "sha256": "cdca659a0004be77f9cce1996a345074d66f0f52535737781e91d3b2fe919985",
            "status": "integrated"
          },
          "figure": {
            "sourceName": "How_to_Pack_a_Context_Window_Textbook_Figure.png",
            "path": "./media/ch1/v04.png",
            "type": "image/png",
            "alt": "Suitcase-style infographic showing a context window packed by priority with optional background and extra history left out.",
            "bytes": 1355871,
            "sha256": "343daeeee3ae747ea992cddffe67fff628012f355b2e09dd15e48ab3fa1f90ed",
            "status": "integrated",
            "width": 1672,
            "height": 941
          },
          "contentStatus": "integrated",
          "version": "0.3.0"
        },
        {
          "id": "ch1-v05",
          "chapterId": "ch1",
          "sequence": 5,
          "title": "How the Context Skeleton Fixes AI Prompts",
          "description": "A reusable context skeleton replaces a mixed prompt with an organized structure that is clearer, more complete, and more repeatable.",
          "concept": "Structured context skeleton",
          "durationSeconds": 75.024,
          "durationLabel": "1:15",
          "media": {
            "sourceName": "How_the_Context_Skeleton_Fixes_AI_Prompts.mp4",
            "path": "./media/ch1/v05.mp4",
            "type": "video/mp4",
            "width": 720,
            "height": 1280,
            "videoCodec": "h264",
            "audioCodec": "aac",
            "bytes": 6115488,
            "sha256": "58fe9968e268852d73131e62de523e49037af348adf24d27b31240dab65b5073",
            "status": "integrated"
          },
          "figure": {
            "sourceName": "How_the_Context_Skeleton_Fixes_AI_Prompts_Textbook_Figure.png",
            "path": "./media/ch1/v05.png",
            "type": "image/png",
            "alt": "Before-and-after diagram showing a messy prompt on the left and a clean context skeleton with labeled sections on the right.",
            "bytes": 1236630,
            "sha256": "ecfc5b45f919b01cb28cf9ab1a4f861d43c7a0fb55e3d77dc63d5beb105c29c9",
            "status": "integrated",
            "width": 1672,
            "height": 941
          },
          "contentStatus": "integrated",
          "version": "0.3.0"
        },
        {
          "id": "ch1-v06",
          "chapterId": "ch1",
          "sequence": 6,
          "title": "How Grounding Stops AI Guessing",
          "description": "Providing the smallest sufficient evidence set turns an unsupported guess into a document-grounded answer.",
          "concept": "Evidence-to-answer grounding",